{
  "capabilities": [
    {
      "mode": "effect",
      "name": "execution.submit",
      "version": 1
    },
    {
      "mode": "read",
      "name": "execution.inspect",
      "version": 1
    },
    {
      "mode": "effect",
      "name": "execution.cancel",
      "version": 1
    },
    {
      "mode": "read",
      "name": "execution.collect",
      "version": 1
    }
  ],
  "connector_protocol_version": 2,
  "deployment_sha256": "dddddddddddddddddddddddddddddddddddddddddddddddddddddddddddddddd",
  "mappings": [
    {
      "account": "runner",
      "credential_scope_sha256": "eeeeeeeeeeeeeeeeeeeeeeeeeeeeeeeeeeeeeeeeeeeeeeeeeeeeeeeeeeeeeeee",
      "host": "runner.example.test",
      "name": "azure-quality",
      "resource": {
        "external_id": "acme/widgets",
        "kind": "repository"
      },
      "service": "ssh-runner"
    }
  ],
  "max_concurrency": 2,
  "max_requests_per_minute": 60,
  "request_bytes": 131072,
  "response_bytes": 4194304,
  "schema_version": 2,
  "timeout_ms": 30000,
  "transport": {
    "kind": "unix",
    "socket_path": "/var/run/magic-glass-box/execution.sock"
  }
}
